,entry,links,listbegin,listend,maxpage,title
66,"manyetiklerin gocmeye meyilli olmamasi, perdelerin asinmamis olmasi, malzemesinin guzel ve kaliteli olmasi, akort burgularinin olculu ""burmasi"", bu hususlardan bikacidir bence. egerturuncuya boyanmi$ ceyiz sandigi da i$imi gorur demiyorsa ki$i, gitar kesinlikle unkapani car$isindan alinmamalidir.klavye*in egri olmamasina dikkat etmeli, cok yuksek e$ikli gitarin parmaklarin aazina sicacagi, cok alcak e$ik yuzunden de tellerin perdelere yapi$ip ilginc sesler cikartacagi unutulmamalidir.princevegipsonlardan uzak durmali, eger dukkan sahibi ""bu kitar gerceh ispanyol"" demi$se ko$arak oradan uzakla$ilmalidir. ayrica gitar alirken parasini odemek her ahlakli vatanda$imizin dikkat etmesi gereken pek muhim bir husustur ... jackgirisi cozurdama yapiyo mu? jack zorlamadan ama cok da kolay olmadan cikartilabiliyo mu?truss rodayari ciddi ciddi dusunulmus mu yoksa sabit olmasina ragmen gereksiz bir ulasim kapagi mi var?sapin egriligini duzeltmek icinklavyedeforme edilmis mi?burgular tel gerginligi olmadiginda da donuyor mu? yoksa dandik mi?tumperdeleri tek tek denediginizde, telin cozurdadigi bir nokta yakalayabiliyor musunuz? satici bunu ufak bir ayarla duzeltmek yerine ""halledilir ayarlarsan"" mi diyo?sap egriligini duzeltmek icin esigin altina caktirmadan yukseltme cubugu konmus mu?sabit olmasi gereken veakordun stabilitesinden sorumlu herhangi bir parcayi sadece elinizle oynayarak hareket ettirebiliyor musunuz?eger varsa,tremolosunun anti-overtension ozelligi var mi? ve tremoloyu 4-5 kere kullandiginizda akordda bozulma oluyor mu?ve en onemlisi, caldiginizda cikan ses sizi tatmin ediyor mu? onunla butunlesecek kadar sevip benimseyebiliyor musunuz? teller ile kasa arasinda elin girecegi kadar mesafe olmamasi.(bkz:awesome gitarlari/2) perdelerinden birinin diğerlerine göre yüksek olup, çalma esnasında o perdeye basıldığında telin perdeye değerek cızırdamaması. kasada ya da klavyeninin önü veya arkasında çatlak, kırık, derin çizik, ezik gibi hasarların olmamasına dikkat etmek. böyle durumlarda genelde satıcı kisvesindeki karpuz size ""abim o bi$ey değil, süper gitar valla, bak sen onu al ben sana indirim yapıcam bi set tel vericem yanında."" falan der ki böyle bir durumun açılımı ""bu bi boka yaramaz ben sana kakalamaya çalı$ıyorum""dur. genellikle çok temiz bir ikinci el falan olduğunu da söyleyebilir, inanmayın. gerçekten titiz ve iyi bi  gitar kullanıcısı o $ekilde vermez gitarı. (bkz:bir basta bulunmasi gereken ozellikler) gitar alınırken dikkat edilecek en önemli husus gitar sapının gövde kalınlığına oranıdır. netekim iyi bir gitarda bu oran 5.4 - 9.6 ideal aralığında olmalıdır. bu oranın doğal logaritmasının tersine ""psap"" denir. kolları nispeten kısa olan arkadaşlar için bu oran çok önemlidir. özellikle arkadaş toplantılarında ve sahilde gerçekleştirilen dinletilerde bu aralıkta bir psap'a sahip olmayan gitar kullanmak kaburgalarda incinme, dirsek ekleminde şiddetli ağrı gibi belirtilerle ortaya çıkan, boyun omurlarında incinmelere bile yol açabilecek ve halk arasında saplandı hastalığı olarak bilinen bir rahatsızlığa yol açar.aynı zamanda acil bir durumda silah olarak kullanılması gereken gitar sahip olduğu bu ideal oranla hem muhatab ile aradaki mesafeyi korumaya yardımcı olur hem de herhangi bir çarpışmada maksimum hasarın minimum kol kuvveti harcanarak meydana getirilmesinde önemli bir etmen teşkil eder. (bkz:bas gitar alirken dikkat edilecek hususlar) sözlükte orda burda gitar konusunda okuduklarimin ardinda bu basligi acma geregi duydum.gitar konusunda uzman oldugumu iddia etmiyorum.ama olmadigimida!!!herneyse.madde 1)bir gitardaki en önemli element gitari kullanan kisidir.ayni gitarin ayni tel ve perdesinden farkli kisiler farkli sesler cikartirlar.tele vurus dan tutun parmkaklarin anatomisine herseyin bunda etkisi var.örnegin benim gitarim bende oldukca mid agirlikli duyulurken julian(diger gitarist) caldiginda oldukca bass agirlikli oluveriyor.bu nedenle ksinin öncelikle kendi calis bicimini kavramasi sart.madde 2)gitar malzemesi...özellikle gövde ve sap in hangi malzemeden üretildigi (mahogany ,basswood ,ash ,plexi ,cam vs vs)cok önemli.her agacin belli bir ton yaratma sekli var.basswood özellikle hafif ,cok hizli ton üreten ve yüksek sesli bir agac(joe satriani ,petrucci ,van halen)bu yüzden genelde hizli calan kisilerce kullaniliyor.mahogany (les paul) ise daha yumusak ,tonu biraz daha gec ortaya atan ve buyüzden daha ilimli bir agac.ama bunun icin de daha tiz.özellikle sg lerde ton bi sekilde cok acik .sap konusunda cok fazla secenek yok.en azindan custom olmayan siradan modellerde genelde maple ya da mahogany kullaniliyor.maple da da bir tiz.madde3)sap yapisi...sapin yapisi calis acisindan cok önemli.ama daha önemlisi kisinin calis bicimine uygunlugu.200bpm civarinda dolasan ya da bunu hedefleyen bir gitaristin tutup etli butlu bir sapi secmesi sacma olur.ya da cikarttigi tiz sesle mahalenin sokak köpeklerini toplayan bir gitaristin 21-22 perdeli gitar kullanmasi.yine de damak tadibir de sapin gövdeye baglanma sekli var...genellikle 3 tipi mevcuttur(bazi firmalar prs ya da siggi braun gibi karma yöntemler kullanabiliyorlar).set neck(les paul ya da klasik gitardaki gibi) .neck thru(tipik pahali jackson ,esp) ve bolt on(fender strat ,jackson dinky ,ve tüm ucuz gitarlar)set neck ile baslayalalim.gereksiz ,ucuz ve ses acisindan bence yetersiz bir yöntemdir.yapiskan ile iki tahtanin tutturulmasi ses acisindan pek parlak bir fikir degil.özellikle elektro gitarda.bir de baglantiyi saglamak icin destek amacli bir cikinti vardir .bu cikinti genelde 18-22, perdenin calinabilirligini zorlastirir.neck thru...kanimca en iyi ama ne yazikki en pahali yöntem.sap gövdenin orta kismini olusturacak kadar uzundur.gövde ile sap pres edilir.hatta bazan icerde vidalanir.manyetikler sapa bagli oldugundan sap agaci daha da önem kazanir.sustainin en yüksek oldugu baglanti tipidirbolt on...vida ve plaka ile tutturulma yöntemidir.özellikle cok hizli gitaristlerin sectigi bir baglanti yöntemi.cok ucuz olmasi nedeniyle en cok kullanilan yöntemdir.vidalanmis cok iyi gitarlar bulmak mümkün netekim tüm stratocasterlar vidalidir.iyi iscilik olduktan ve sap tam oturduktan sonra sorun yok.madde4)manyetik....bu cok gereksiz bir tartisma cünkü manyetikler yapilari ve üretimleri geregi pahali diiller.bence bir gitar alir iken eger orta sinif bir gitar alinacaksa gelecege yatirim yapilmali ve özellikle agac/iscilige bakilmali.manyetik degistirmek is diil.....ama konuya deginmisken tamamliyayim.2 tip manyetik yine 2 ye ayrilabilir.single coil (tek sirali) ve humbucker(cift sirali) bunlarin da aktif ya da pasif olma sanslari var.aktif/passif olayi cok uzun bir tartisma konusu.zevkler ve renkler tartisilmaz.her ikisininde avantaj ve dezavantajlari var.aktif manyetikler gürültüsüz ,yüksek sesli ve nötraldir.takildigin gitarin agac karakterini ortaya koyar.ama bunu yaninda;kanimca tabi; oldukca ruhsuz bir tadi var.örn kirk hammet.zakk wyld ,steve lukater...pasif manyetiklerin model markaya göre degisen gürültüleri vardir.manyetik alan daha büyük oldugundan telleri daha fazla etkilerler.bu da sustain ve akord konusunda negatif etki yaratir.ama calis biciminde ve gitarin karakterine daha cok renk katarlar.sesleri daha dogaldir.örn joe satriani ,steve vai ,scott ian ,dimabag darrel (a.r.e) dave mustaine ,vs vs vs....humbucker  singelcoil e göre cok daha gürültüsüz ve daha dolu bir sese sahiptir.eger yüksek düzeyde gain ile calinacaksa tercih edilmelidir.bunun yaninda singlecoil daha dinamik ,ve daha vurguludur.özellikle country ,blues ve jazz konusunda tercih edilir.madde5)...iscilik....pekcok firmanin fabrik üretimi gitarlarlari hatalidir.gitar pet sise olmadigindan ve üretilen her gitar tonla agac ve metal parcadan olustugundan ,almadan önce dikkat ile gözle muayene edilmeli ve calinmalidir.madde6)...marka ve prestij....jackson basligindan da anladigim üzere ,cevremizdeki bilirkisilerin ya da bilirkisi kilikli cahillerin övgü ve sövgüleri ile ise kalkmak ,genelde sokaga para atmak demektir.tamam servis ,garanti , ve fiyat önemli kriterlerdir ve marka ile bütünlesmis olduklarindan da marka konusunda fikir verirler.ancak onu alma bunu al mantigi oldukca yanlistir.clapton strat icin yanip tutusurken neden santana prs kullanir???her ikisinin de övgü ve sövgülerini merk ediyorum dogrusu.bu yüzden en saglami denemek.calmak ,duymak ,ayarlarla oynamak....madde7)köprü....tellerin gövdeye baglanma seklini ,tellerin gövdeden sapa iletilme seklini belirler köprü.temelde 2 ye ayrilir.sabit köprü (tunamatic/wilkinson ve kahler in bagzi modelleri.....les paul de oldugu gibi) ve hareketli köprü(floyd rose/kahler fender gibi).hareketli köprü olayinin da 2 sekli var.tek yönlü(sapa dogru) ve cift yönlü.köprü hem calinabilirlik ,hem tel degistirme frekansi/kolayligi ,ama en önemlisi ses olusumu acisindan cok önemli ve belirleyici bir faktördür,köprünün malzemesinden agirligina ,tellerin oturma biciminden gövdeye baglanis bicimine kadar her ayrintisi önemlidir.ben sahsen sabit köprü kullaniyorum.hem akor daha uzun süre dayaniyor ,tellerin kopma riski daha düsük hem de sustain daha uzun ve salinim daha güclü.ama bu gitarin sesini yükseltiyor.hatalar daha duyulur hale geliyor.temiz calmayan biri icin pek uygun degil.floyd rose da ise tel degistirmek ölüm.yaylari dogru ayarlamak laazim.her dive bomb olayindan sona akord etmek gerekiyor.ses daha kisa ama daha vurucu ,tapping tipi teknikler icin daha uygun zira hatalar dha aaz ortaya cikiyor.daha odaklanmis bir ses.bir de eger vibrato kolu calsi stilinde önemli bir yer tutuyorsa...secenek bu olmali tabiiimadde8)gitar disi etkenler....bunlara amp ve efekt aletleri giriyor.eger evde bilmemkac milyarlik amp ve elektronik alet edevat duruyorsa ,alinacak gitar bu aletlerle test edilmelidir.mesela seramik manyetikli ,baswood string thru bir gitari marshall jcm 800 ile calin!!!sanki alet gitar diil bass!!!öte yandan ayni gitari bogner übershall ile calin.alet sanki v 12 motor....ama peavey 5150 ile calin.siir gibi.tabii v12 hastasi biri icini 2.sini öneririm.kisaca budur...iyi eylenceler.",https://eksisozluk.com/gitar-alirken-dikkat-edilmesi-gereken-hususlar--329481,14.06.2002,05.03.2019,2,gitar alırken dikkat edilmesi gereken hususlar
67,terliği de fırlatarak bira getir diyorsa sorun olmayan durum.,https://eksisozluk.com/annenin-sigara-icerken-elektro-gitar-calmasi--5959872,04.03.2019,04.03.2019,1,annenin sigara içerken elektro gitar
68,"bu isimles paulolur sanırım.türk olarak iseerkan oğurderiz.edit: sayın yazarlar arka arkaya 20 tane isim sıralamanın alemi var mı? ilk isim ve de açıklaması kafi olacaktır. tamamblind lemon jefferson,brownie mcghee'lere kadar biliyorsunuz gitaristleri anladık.* benim aklima direkt kendim geliyorum*.insanlar beni henuz bilmedikleri icin onlara sordugunda populerliklerinden oturu sunlardan biri gelir muhtemelen:(bkz:carlos santana)(bkz:eric clapton)(bkz:kirk hammett)(bkz:jimi hendrix)(bkz:kurt cobain)en iyi gitarist demiyorum dikkat edersen, o baska bir tartisma konusu.edit: arkadasim adam en iyi gitarist dememis, randy rhoads yazmayi biz bilmiyoruz sanki. (bkz:joe satriani) (bkz:johnny guitar) at olanı... üst komşunun ergen oğlu, o çalmayı öğrenene kadar ben unutacağım galiba. (bkz:leo fender) (bkz:steve vai) (bkz:nuno bettencourt) (bkz:jose feliciano) buckethead",https://eksisozluk.com/gitar-denince-akla-gelen-ilk-isim--5364663,12.05.2017,01.03.2019,41,gitar denince akla gelen ilk isim
69,"telleri direkt olarak prize sokarak elektriğe bağlamasıyla birlikte, kaçınılmaz sona ulaşan adamın başına gelendir. eğer ilkokulu bitirdiyseniz tele elektrik vermemeniz gerektiğini bilmeniz gerekir. bas gitarın da pedala basılarak çalındığını zannetmektir.(bkz:adam konuyu çok yanlış anlamış beyler, dağılın) bahse konu olan video fake'tir, senaryodur.basit elektrikli cihazları tamir edebilecek, lehim yapabilen her insan elektro gitarın elektrik devresi kısmını yapabilir. facia da olmaz, korkmayın. insanın göz göre göre ne kadar aptal olabileceğini öğretmiş vidyodur. elektriği götünde hisset sonra istediğin kadar küfret. kamil seni. sanırım akrabamı buldum dedirten videodur.15 sene önce led lambaya lehimle 2 tel ayak bağlayıp prize sokmuştum, bütün apartmanın sigortaları atmıştı. elektro gitarkavramını tamamen götünden anlamış hintli kazası. alırsın eline böyle. ilk izlediğimde türk sandığım hintlivideosudur. sonu yarım yarım yarmıştır. ingilizce başlığı ""elektro gitar nasıl yapılmaz"" olan yaran video.(bkz:salak yemin ederim gerizekalı bu çocuk ya) dostum elektro gitar demişsin ama bu baya elektrik gitar. kavram olarak elektro gitarı tamamen götünden anlamış eşşşek kadar adam bok yemesi. hintlilerden bu kadar salak adam çıkmaz halbuki.",https://eksisozluk.com/ev-yapimi-elektro-gitar-faciasi--4005305,31.08.2013,27.02.2019,2,ev yapımı elektro gitar faciası
70,"her gitar ogrencem diye kursa gidenin bir tane aldigi misina telligitarlara verilen isim.. klavyesi elektro gitara gore kalin ve kisa en gelismis cok sesli telli calgi koyunbaba yi dinledikten sonra hayran olunacak muzik aleti su anda kullanilmakta oldugumuz klasik gitar 7. yuzyilin sonlarina dogru ronesans ve barok modellerini astiktan sonra ortaya cikmistir. armonik kasasi 8 seklindedir. bu kasadarezonansdeligi bulunmaktadir. perdelerin bulundugu kolda genellikle 19 perde yer almaktadir. bu perdeler metal bolmelerle birbirinden ayrilir. telleri 6 adettir. klasik gitar, orjinaline gore degisik bir tonda parcayi seslendiren bir alettir*ve esas sesler alt oktav da bulunur. en iyi modellerinde armonik tabla cam agacindan yapilmistir .yan kisimlar ile arka bolum akcaagac veya pelesenk ten olup kolu ve uc bolumu sedir veya maun dandir. telleri naylondur ancak 4,5 ve 6 inci teller spiral olarak celikle sarilidir. sapı safîabanozağacından olduğunda değerli; hoş enstrüman. gövdesi için en uygun malzeme gül ağacı (özellikle hint veya brezilya gül ağacı),  uç kısmı içinse kızılağaç, sedir veya ladin olan vesynthesizerlar tarafından taklit edilemeyen tek sese sahip olan enstruman. girdikten hemen sonra derinleşen denizler vardır ya işte bu klasik gitardır. (bkz:terci korad gitar ikilisi) (bkz:soner egesel) eskimiş ise kış mevsiminde kalorifer peteğine dayadığınızda teli kopan alet. geçen sene başıma gelen bu üzücü hadise benim için gerçekten klasik olmuş emektar gitarımın telini onararak durumu kurtarmamla tatlıya bağlandı.",https://eksisozluk.com/klasik-gitar--49921,21.11.1999,11.02.2019,10,klasik gitar
71,bateriste karşı boş olması ihtimali genelde az olan kız.ayrıca (bkz:bas gitar çalan hatun) (bkz:aramaya inanmak) hepsi kız gibi maşallah. pardon kendimi adnan oktar programında sandım. (bkz:ayşegül inci) (bkz:tina weymouth) (bkz:marta altesa) (bkz:paz lenchantin) https://www.youtube.com/watch?v=jui0z_0bg60aklıma ilk gelen https://www.youtube.com/watch?v=c_xy_pd_or8aklıma ilk gelen.,https://eksisozluk.com/bass-gitar-calan-kiz--4582846,24.10.2014,06.02.2019,1,bass gitar çalan kız
72,https://youtu.be/zbwc5ye-ululinkteki adamdır.böyle el işi videolarını izlemek kişide hipnotize etkisi yaratıyor. (bkz:sözlüğün iyice ınstagram'a dönmesi),https://eksisozluk.com/boya-kalemleriyle-gitar-yapan-adam--5922288,28.01.2019,28.01.2019,1,boya kalemleriyle gitar yapan adam
73,"uzaylılarla kurulacak temas sonrası kendimizi onlara tanıtırken dinleyin ulan develer bizde ruh var ruh denilerek dinletilecek solodur, şimdi yaşımız da epey bir ilerlediğinden megadeth dream theater ne bileyim iron maiden gelmiyor aklıma heralde ben whitesnake is this love dinletirdim.yetenekse yetenek, duyguysa duygu..biz öyle bir anda yok edilecek bir topluluk değiliz sevin bizi saygı duyun..gerçi insanlıktan alabilecekleri tat keçi boynuzundan alınanla orantılı bir boka yaramayan kocaman bir yığın var.. gitar solosu değil amaburadanasa tarafından hali hazırda voyager uzay aracında bir plak içerisinde, uzaylılara gönderilmiş olan müziklerin listesine ulaşabilirsiniz.ayrıca içerisinde türkçe olarak""sayın türkçe bilen arkadaşlarımız. sabah şerifleriniz hayr'olsun*"" mesajının da yer aldığı 55 farklı dilde selamlama mesajı da bulunmaktadır.plak içerisindeki diğer şeylerin listesiniburadangörebilirsiniz. tabii ki de comfortably numb'ın pulse versiyonundaki gitar solosudur.yörüngelerini şaşırırlar yeminle.",https://eksisozluk.com/uzaylilarla-paylasilmasi-gereken-gitar-solosu--5921373,27.01.2019,27.01.2019,1,uzaylılarla paylaşılması gereken gitar solosu
74,"şahsım adına bir çocukluk sanrısıdır bu, küçükkenelead gitarıntremolokolu çıkartıldığında rhythm gitar olur sanırdım.. adı üzerinde olduğu gibi lead gitarla solo atılırken ritim gitar ile ritim tutulur ki biz bunlara genelderiffadını veririz. ancak bu her zaman böyle olacak diye bir kaide yoktur. yeri gelir lead gitarla da ritim tutulur, ritim gitarla da solo atılır.metallicaüzerinden örnekleyecek olursakjames hetfieldritim gitar çalarken,kirk hammettlead gitar çalar. lead gitar bol bol egzersiz ve gam bilgisi, ritm gitar ise sağlam akor bilgisi ister.",https://eksisozluk.com/lead-gitar-ile-rhythm-gitar-arasindaki-fark--555875,04.03.2003,27.01.2019,1,lead gitar ile rhythm gitar arasındaki fark
75,"gitar, pedal ve amfiler üzerine içerik üreten muazzam youtube kanalı. yıllardır türkiye'de bu tarz kaliteli içerik üreten youtube kanalı yoktu. konseptandertons musicile aynı fakat kesinlikle özentilik durumu yok. onur ve emir abilerimiz de oldukça tontiş insanlar.",https://eksisozluk.com/gitar-edevat--5918611,25.01.2019,25.01.2019,1,gitar
76,"bir devrimcinin ölmeden önce son isteği...deniz gezmiş bedeni ölü düşünceleri dipdiri yakın zamanda telefonuma indirdiğim ama hiç dinlemediğimsabah saat 4te playlistime girenve beynimi dağıtan müzik kanun ve piyano ile çalınan hali de olan ünlü konçertodur.şarkı (bkz:rodrigonun gitar konçertosu)(bkz:concierto de aranjuez) dinle ve deniz'i an, neden mi? son istegiydi dar agacina gitmeden.",https://eksisozluk.com/rodrigo-gitar-koncertosu--4446422,12.05.2018,21.01.2019,1,rodrigo gitar konçertosu
77,cilveli kadriyeolarak da anılan kadriye hanım'ın 69 yaşında olmasına rağmen muhteşem şekilde gitar çalarak 20-30 yaş arası erkekleri çevresine toplaması durumunu özetleyen cümle. https://www.facebook.com/…6/posts/2279901982088151/,https://eksisozluk.com/kadriye-hanimin-gitar-calip-erkekleri-etkilemesi--3382476,14.05.2012,18.01.2019,1,kadriye hanım'ın gitar çalıp erkekleri etkilemesi
78,"https://www.youtube.com/watch?v=zbwc5ye-uluadresinde görülebilecek bir değişik olay. bu kendin yap videoları neden hep avrupa amerika'dan çıkıyor biz neden bu kadar vasıfsızız gerçekten merak ediyorum. hayır şimdi tabi ki bizdeki bağlama ustalarını, gitar ustalarını biliyoruz ama herhangi bir ecnebi bu tür işleri yapacak yeri de malzemeyi de buluyor bizim ise boş zamanlarımızda yapabildigimiz şeyler belirli ev, avm, cinemaximum, bilet bulabilirsen tiyatro, dışarıda yemek yemek, internette vakit öldürmek... çok boş yaşadığımı bana hatırlatan videoya konu olan eylem.",https://eksisozluk.com/renkli-kalemlerle-elektro-gitar-govdesi-yapmak--5907174,14.01.2019,14.01.2019,1,renkli kalemlerle elektro gitar gövdesi yapmak
