,entry,links,listbegin,listend,maxpage,title
49,"madem eskinin kutsal bilgi kaynağıyız -artık değişik bir ortam olduk- bir kaç bilgi de biz atalım ortaya.not: buraya herkes bildiği bir kaç şey eklerse, belki bu çok güzel ama hakettiği popülariteye ulaşamamış enstrüman hakkında güzel bir başlık oluşturabiliriz.not 2: en sonda işe yarayacak linkleri sıralayacağım.öncelikle birklasik gitaredinmemiz gerekiyor -büyük şok. sonrasında da yılmaz bir irade.enstrümanı alırken de ucuza kaçmamak lazım, bütçeyi sarsmadan edinilebilecek en iyi enstrüman alınmalı. pek çok üreticinin çok popüler öğrenci gitarları vardır, 400-600 tl arasında fiyatları değişen -en popülerlerinden biriyamaha c40modelidir- onlara bakılabilir. 200-300 tl aralığında da yeterli gitarlar bulmak mümkündür tabi. daha iyi gitarların ikinci elleri de her daim iyi bir opsiyon olsa da, eğer ki gitarlar hakkında bir bilgi yoksa kaçınmak iyi olacaktır.içinize sinmeyen enstrümanı almayın, bu çok önemli. sizi müzikten soğutabilir.sol el tırnaksız, sağ el ise tırnaklı olacak. klasik gitar tırnakla çalınır. pena telleri koparabilir. koparmasa da yıpratır. kaldı ki, pena sizi kısıtlar, klasik gitar tekniğinde penanın yeri yoktur. bununla beraber akustik gitar -çelik tel- tırnakla çalınabilir ancak o da tırnaklara zarar verir; kırabilir.sağ elde tırnak uzunluğu kişinin tekniğine kalsa da, genel görüş çok uzun olmayacak, avuç içi yüze dönükken bakıldığında, tırnak 2-3 mm geçiyor görünse yeter şekilde uzatmak yeterli olacaktır. burada tırnak uzatırkenki şekil de önemli, kimileri doğal bir uzamaya bırakırken, kimileri sağa doğru rampa olacak biçimde bırakır, kimi de sola rampa oluşturur. ancak sivri uç yapmak, ok ucu gibi düşünün, ses aralığını kısıtlar, tone production denilen olayda kişiyi kısıtlar. tamamen sivri bırakmak kadar düz törpülemek de aynı sorunlara sebep olur.temel nokta, uzunluğu ve şekli kişinin tekniğine bağlı kalarak, telleri yakalamayacak ve pürüzsüz şekilde törpülenecek. tırnağın uzatılan kısmına parmak sürüldüğünde, aynı bir cam gibi kayacak.gitar ve tırnaklar tamam. peki nereden, nasıl öğreneceğiz?elbette bir eğitmen varsa çok güzel. bir arkadaş veya öğretmen, farketmez. en baştan sizi hatalı teknikten ve sakatlıktan korur. sonradan düzeltmesi zor olan alışkanlıkları edinmenizi engeller.bulunulan bölgede eğitmen yoksaskypeüzerinden de ders veren kişiler mevcut elbette.o da yoksa,delcampforumlarına üye olunup, yıllık online -ücretsiz- derslerine kayıt olabilir kişi. böylece hem eğitmen, hem de kendisiyle aynı zevkleri paylaşan yoldaşlar edinmiş olur.bunların hiç biri olmuyorsa, olur ya, oradaki dersleri anlayamaz kişi veya tempoya ayak uyduramaz, bir metot kitabı edinip oradan da çalışabilir. ilk başta zorlansa da, temposunu bulduktan sonra gayet başarılı olabilir.ancak iş burada bitmiyor. bir enstrümanı iyice öğrenebilmek için, müzik diline de hakim olmak lazım. o yüzdenmüzik teorisini de kişinin bilmesi şart. elbette bilmeden de çalabilirsiniz bir şeyler, ancak öğrenirseniz, sınırı sadece siz belirlersiniz.çalışma temposunu da iyi ayarlamak lazım. genelde 45 dakikalık dersler olacak şekilde, yapılabilirse günde 3 ders harikadır. hele hele bu işi hobi olarak yapan birisiyseniz. elbette öğrencisi daha yoğun çalışır. ancak günde 45 dakika dahi yeterlidir. onda da 20, 25 dakika civarı bir kaç dakikalık bir mola vermek, sağlık için iyidir, kaslar ve zihniniz bir dinlenmiş olur.örnek bir program yapacak olsak eğer 3 tane 45 için, son 45i tamamen repertuvara ayırıp -yeni parça öğrenme ve eskileri tekrarlama-, 2. 45te ise üzerinde çalışılan parçadaki tekniklere zaman ayırıp, gam çalışılırsa, ilk 45te bir gün sağ el, diğer gün sol el egzersizleri yapıp, haftada bir gün de boş bırakarak gayet dengeli bir öğrenim yapılmış olur. müzik teorisine ise kişi günde 15 dakikasını ayırırsa, temellerini 1 ay gibi bir sürede öğrenebilir.bir ay kadar bir süre boyunca parmak uçları acıyacak, nasır tutana kadar da bu devam edecektir. o kısmı atlatabilmek çok önemli. bu süre içerisinde, ben yeni öğreniyor olsam, bol bol müzik teorisi ve sağ-sol el egzersizleri yaparım, herhangi bir derse başlamadan. böylece derslere hızlı bir giriş yapılır ve derslerdeki materyallerde daha az yorulur kişi. hem koordinasyon ve yer bilgisi de artacağından, öğrenme hızı da artar.şimdilik ekleyecek bir şey göremiyorum, gerek gördükçe burayı güncellerim. şimdi gelelim kaynaklara;müzik teorisimusic theoryçok harika tasarlanmış, ücretsiz bir site. bol bol egzersiz de vardır.teoriayukarıda sitenin bir benzeri.open music theoryyukarıdakilerle benzer bir site.dave conservatoirekhan academybenzeri bir site.music theory lessonsbiryoutubeplaylisti. gayet başarılı ve anlaşılır bir dile sahip.topluluklardelcamp forumlarıklasik gitar üstüne daha iyi bir site yok. burada ücretsiz onlarca metot kitabına, sheet music'e, derslere, ipuçlarına vs. vs. ulaşabilirsiniz. daha fazla şeye ulaşabilmek için daha aktif kullanmak gerekli. fakat sadece kayıt olmak, metot kitaplarına, sheet music'e ve giriş derslerine erişebilmek için yeterli./r/classicalguitar/reddit. kafa karışıklığı için, sohbet için ya da güzel bir parça paylaşmak için gideceğiniz yer ise burası.metot kitaplarıkanımca en iyisi, biraz da modern olması sebebiyle,christopher parkening'inkitaplarıdır. 2 cilttir, verilecek her kuruşa değer. elbette bulmak isteyen para vermeden de edinebilir.ille de para harcayacaksanız, sadece o kitaba para harcayın.bunlarla beraber, delcamp forumlarından edinebileceğiniz pek çok ücretsiz, artık telif dışı, kitap da vardır. gerçekten işe yarar bir kaçını sayacak olursak eğer;julio salvador sagreraspascual rochdionisio aguadomatteo carcassiteknik-egzersiz kitaplarıen bilineni şüphesiz kiscott tennant'ınpumping nylonadlı kitabıdır. türkçesi olmasa da anlamak zor değil.bir diğeri de, biraz daha mantıklı ilerleyeni,ricardo iznaola'nın kitharologus'u,the path to virtuosity.hector quine,guitar techniqueabel carlevaro,school of guitarher yerden ücretsiz edinebileceğiniz,guiliani,120 right hand exercises-sağ el üstüne daha iyi çalışmalar yoktur.bilinesi bazı sitelerthe guitar schoolthis is classical guitarclassical guitarclassical guitar cornerclassical guitar shedizlenmesi gerekli bir kaç videoa guitar lesson with abel carlevarowilliam kanengiser, effortless classical guitarfrederick hand, classical guitar technique and musicianshipsanıyorum bu kadarı, yeni başlayan birisine gayet yeterli olacak, en başta oluşan kafa karışıklığını gidermesine yardımcı olacaktır.bitirirken söylemek isterim ki, 1 yıl içerisinde istediğiniz noktaya gelmeyeceksiniz. 2 yıl içinde de. bir zaman gelecek ki zaten hiç yeterli gelmeyeceksiniz. büyük olasılıkla o noktada gitar çalmayı öğrenmiş olacaksınız.kolay gelsin. öğrenmeyin. iki ay sonra dolap üstünde tozlanacağını bile bile alacağınıza o parayı bana verin gidip kendime tezgah üstü mikser alayım, mis gibi. parmak uçları nasırlaşana kadar, sol brachioradialis ile sağdaki arasındaki hacim farkını görene kadar durmak yok azimle devam. sadecehttp://www.klasikgitarcalmakistermisiniz.com/adresinden haftalık dersleri takip edin. haftada 3 gün 30-40 dakikalık düzenli çalışın. nota ve bona eğitimlerinize de gitar çalışmalarınız kadar önem gösterin. (bkz:gitar çalacaklara tavsiyeler) başlığında bayağı bir şey yazıldığı için bilgiye erişim endişem giderilmiş olsa da ""klasik gitar"" başlığı altında daha hususi şeyler yazabileceğimi, arayan kimse ile daha çok temas edebileceğimi düşündüğüm için buraya yazmak daha güzel olur sanırım.gitar, kucağınıza alıp sarıldığınız ve saç tellerine dokunduğunuz bir enstrüman olduğundan herkesin kendine münhasır dokunuşları olacaktır. yazdıklarımı bunu gözeterek okumanızda fayda var.öncelikle başlangıç klasik gitarı diye bir şey yoktur. burası net. kötü tuşeleri olan rezil bir sanchez ile başlayıp yanlış tutuş tekniğiyle sol bileğimde yumru haline gelmiş eklem sıvısını bir sene taşıdım. telleri yüksek olmayan, perdelere yakınsak bir gitarı seçebilirseniz güzel olur. tel markası veya gitar markası için bir şey diyemem ancak low tension denilen basımı daha rahat tellerden alırsanız küçük parmak kaslarınızı çok yüklenmemiş olursunuz.çalmaya başladıktan sonra şayet işlerin ciddileştiğini hissediyorsanız derhal kaliteli bir klasik gitar alın. iyi ses aldığınız gitarlarda kulaklarınız daha güzel ve pirüpak gelişir. tekrar söylüyorum, başlangıç klasik gitarı hatta başlangıç enstrümanı diye bir şey yoktur.nasıl başlarsanız öyle gider. burası da net. ilk öğrendiğiniz bütün temel hareketlerde kurallara istisnasız inat edip uyun. basitinden söyleyeyim; g akorunu serçe, yüzük ve orta parmak kullanarak basılan, ki böyle basılır, şekliyle ısrarcı olarak öğrenin. g akorunu bu şekilde öğrendiğinizde c akoruna c diminished'a ve sair gidişatlara alışmanız çok daha kolay ve şık olacaktır. ama bu akor işaret parmağı ile daha kolay basılıyor deyip 3 sene sonrapaganini c-dur sonataöğrenmeye kalkarsanız, tarantulanın bacaklarına dönmüş parmaklarınıza ağlayabilirsiniz :)yukarıda söylediğim konu için bach'ın bourre'sinde gerçekten çok zorluk yaşadım. parçayı öğrendikten 2-3 ay sonra tekrar çalayım dediğimde parmaklarımın gitmediğini görmek çok acı vericiydi. parçayı sanki hiç bilmiyor gibiydim. parmak gitmiyor çünkü yanlış nota-parmak kombinasyonu ile kolaya kaçtım. lütfen yapma.başlangıçta muhakkak akortlanmış enstrüman ile çalışın. kulak doğru düzgün otursun. (bkz:ricardo moyano)'nun öğrencilerine kulak gelişimi için farklı akortlanmış gitarlarla çalıştırdığı gerçeğini de buraya bırakıyorum.(bkz:yngwie malmsteen)'e ait bir sözü ekleyeyim: hızlı çalmak istiyorsan, yavaş çal. herhalde yeryüzünde en ""hızlı"" çalabilen bir insandan bunu duyabilmek ilginç olsa gerek. tane tane lütfen.varsa sabrınız ilk üç ay kromatik egzersizlerden şaşmayın. büyük gitaristlerin dahi parmak egzersizlerini sabırla yaptıkları bir gerçektir. yukarıdan aşağıya, soldan sağa, sabırla gezinin. her bir parmağa dikkat ede ede. birinci parmak birinci perdeye, ikinci parmak ikinci perdeye şeklinde..metronom kullanın. başlangıçta anlamsız ve gereksiz gelecektir. sonradan teşekkür edersiniz. aşırı yetenekli küçük süper gitaristlerin, zaman kavramı zihnen gelişmediği için metronomla çalışsalar dahi çaldıkları eserlerde (uyarlama eserlerde özellikle) ses kaymaları olabilmesine şaşmamalı. çok ince bir prensiptir ancak etkisi ileride büyüktür.bir gün çalışmazsanız, iki gün gerilersiniz. ilki o gün için, ikincisi de dün unutulduğu için. gitara başlarken aldığım en güzel tavsiyelerden biriydi. özellikle ilk iki sene bazı şeyler refleks düzenine gelene kadar sabredin.(bkz:ahmet kanneci) hocanın da şöyle bir sözü vardır ki yüreğinden çalmak geçmiyorsa, o gün eline alma. yer yer katılmasam dahi ""tıngırdatmak"" için dahi elime aldığım günlerin bir faydası olmadı.gitar tabları ile çalışmayı size bırakıyorum. nota bilginiz olursa ufkunuz açılır, önünde sonunda notalara mahkum kalacaksınız. haberiniz olsun. tablarla istediğiniz parçayı öğrenseniz dahi bir süre sonra patlıyorsunuz. tekrar haberiniz olsun.şahsi hatalarımdan birisidir. arpejin olduğu parçalardan daha çok keyif alırdım. solonun baskın geldiği parçalardan kaçınırdım. bugün açıkçası ıkınıyorum. dengeli gitmek isterdim.penayı elinize almayın. (solo ile tezat gibi durdu) konservatuar öğrencisini pena ile görürlerse okuldan attıklarını biliyorum. elektro kökenli arkadaşların penanın mahareti sayesinde ""daha dinlenilebilir"" görülse de gitarda esas oyun sağ elde döner. sol parmaklar bir şekilde oturuyor. pek inandırıcı gelmeyebilir bilmiyorum ama gitarda uzmanlaşma sağ el ile olduğu kanaatindeyim.klasik müzikte ısrarcı olun. şahsımca gitarın seçkin/elitist bir yerindesiniz. az ama öz insana hitap edersiniz. mozart, beethoven ve vivaldi'den öteye geçemeyen çakma lümpenleri bir güzel ayıklarsınız.gitarın klavyesini bol bol gezin. ilk üç perdeye sakın tıkalı kalmayın. bunu da gam öğrenerek aşabilirsiniz.gitarınızı cam kenarına, kalorifer peteklerinin yanına bırakmayın. ısıma soğuma ile tahtalar genleşip bir sabah kalktığında 12. perde civarından cız almaya başlayabilirsiniz. gitar ayaklığını almanızda fayda var.------- temel sorulara amele cevaplar ------kulağım gelişir mi? belki (bkz:perfect pitch) olmak mümkün değil ancak hayvan gibi geliştiğine şahidim. gelişir elbet. sen sabret.kulaktan duyduğumu çalamıyorum? sen makina değilsin. olma da zaten. gitarı kulaktan akortlamak üst düzey bir yetenek değil. gelişir. gitarın akortsuz olduğunu fark et, yeter.bende yetenek var mı bilmiyorum? yeteneğe gerek yok. sıkı çalışmayla yeteneği elde edersin. sabırla devam et.kursa yazılmalı mıyım? klasik gitar için ise evet. ben gittim mi hayır. gitmeli miydim, evet. gitseydim bazı şeyler daha hızlı ve daha acısız olur muydu? evet.nota öğrenmeli miyim? öğrenirsen yüzersin. bilmezsen mavi renkli şişme çocukluk havuzunda takılırsın. sen bilirsin.yaşım geç mi oldu? hiçbir zaman geç değil. biraz daha vakit alır.parmaklarım uygun mu? bazı parmak yapılarının avantajlı olduğuna şahidim. kabul. (bkz:franz liszt) her gece parmaklarının daha büyük olması için dua ettiği söylenir. liszt'in dahi çektiği bir dert. kasma istersen :)tırnak bırakmalı mıyım? bir süre sonra muhakkak bırakırsın. oje, beyaz kalem ve hatta törpü dahi alırsın. ki törpü kullan lütfen.gym'e gidip vücud geliştirebilir miyim? klasik müzikte yetkinleşmek, ilerlemek istiyorsan hayır, gidemezsin. küçük kaslarını öldürme.------ şimdilik yeter ----son olarak da ufak bir sanatçı yol haritası çizeyim.(bkz:maurio giuliani)(bkz:fernando sor)(bkz:ferdinando carulli)(bkz:gaspar sanz)(bkz:matteo carcassi)(bkz:dionisio aguado)bu zatların başlangıç seviyeler için çok güzel besteleri olduklarını düşünüyorum. çok güzel allegro'ları andantino'ları vardır. zaten 1600 - 1800 arası yaşamış temel/basic ve gitara yön veren ayrıca gitarı halk ile buluşturan, tanıtan kişiler. içlerinde yüreğinize dokunacak muhakkak onlarca parça vardır. tekrar gitara başlayacak olsam bu kimselerin eserlerinde ısrarcı olurdum.herkeste bir asturias furyası akıp gidiyor. gitarda virtüoz eserlerden biridir, kabul. ancak bach'ın (bkz:chaconne) eseri yahut domenico scarlatti'nin k.1 l.366 sonatası, koyunbaba, usher waltz derken liste uzayıp gider. yarıştırmak değil niyetim ancak üst düzey parça olarak asturias'ta takılıp kalmayın. biri bana asturias'ı soruyorsa laf aramızda o kişiyi çiziyorum.(bkz:francesco tarrega)(bkz:leo brouwer)(bkz:heitor villa lobos)(bkz:ısaac albeniz)(bkz:nicolo paganini)veya ne bileyim; bach, albinoi, satie gibi kişilerin eserlerini orta seviyeye geldikten sonra, bir iki yılın akabinde girişmenizi tavsiye ederim. pardon, bach'a bulaşmamanızı da tavsiye etmeliydim. en az beş sene, bilmem açık mı oldu :)dinleme işine gelirsek de büyük icracıları siz de zaman geçtikçe ve çalıştıkça fark edeceksinizdir. kısa bir liste yapmama gerek yok fakat kendi hissettiklerimi söyleyeyeyim: duygu istiyorsam segovia'yı, teknik görmek istiyorsam john williams'ı tercih ederim. canlı görmek de nasip olsa da notaların duygusunu size eksiksiz yaşatabiliyor ama kendi duygularının notasını değil.ikisinin karması olarak her zaman (bkz:aniello desiderio) hoşuma gitmiştir. kusursuz tekniği, dolma dolma parmaklarıyla çok garip duyguları size hissettirebiliyor. bir röportajında ""eminönü'ne geldiğimde bana napoli'yi hatırlattı, o yüzden istanbul'a geldiğimde hiç yabancılık hissetmedim"" demişti. belki de bu cümlesi için seviyorumdur, bilemiyorum :)aklıma gelenler bunlar şimdilik. umarım yardımcı olabilmişimdir. ne güzel bir memleket ki herkesin birer kere enstrümana dokunmuşluğu yahut her ebeveynin evladına miras bırakacağı ""bir hoş seda""sı var. bıkmadan devam edin. öpeyrum sizi.",https://eksisozluk.com/klasik-gitar-ogrenmek-isteyenlere-tavsiyeler--4824971,18.06.2015,17.04.2019,1,klasik gitar öğrenmek isteyenlere tavsiyeler
50,vol tuşu tellere çok yakın olduğu içinpalm muterifflerinde gitarın sesini istemsizce kapatabileceğiniz seridir.trash metaliçin tonları gayet başarılıdır.,https://eksisozluk.com/esp-destroyer-serisi-elektro-gitar--6002097,10.04.2019,10.04.2019,1,esp destroyer serisi elektro
51,"ibanez ve schecter firmasının 2014 yılında üretmeye başladıkları gitar modeli. benim kanaatime göre 6 telli bir gitar ile 7 telli bir gitarın çalma pratiği ve scale açısından çok bir farkları yoktur. ama 8 telli gitar ile ilgilenen birisi var ise direk 9 telli gitar alsa daha iyi eder, belki gitarın hakkını vermek için çok uğraşır ama uğraştığına değer. evet.http://www.ibanez.co.jp/…ing/rg_series.html#9stringhttp://www.schecterguitars.com/…llraiser-c-9-detail (bkz:g string guitar) satriani'nin mutlaka çalması gereken gitardır. muhtemelen de şaha kaldıracaktır.(bkz:yine de şahlanıyor)https://www.youtube.com/watch?v=-9agxhuzcbshttps://www.youtube.com/watch?v=tkhtxijiwsi (bkz:wesley belmont) (bkz:bokunu çıkarmak)bu hızla giderse ölmeden13 telli elektro gitarı görebiliriz, resmen şahane. telini bulamazsın onun.benim için gereksiz bir gitar zaten akorları bile eksiltmeli çalıyorum mk. standart akordu c# standard olan enstrüman. (c#-f#-b-e-a-d-g-b-e)",https://eksisozluk.com/9-telli-elektro-gitar--4614381,28.11.2014,10.04.2019,1,9 telli elektro gitar
52,dünyaca ünlü fender gitarlarının mucidi leo fender’in gitar çalmayı bilmemesi...şaşırtmıştır.(bkz:terzi kendi söküğünü dikemezmiş)not: kendisi 1991 yılında vefat etmiştir. ruhu şâd olsun. çok dürüst adamdı rahmetli. gitara para verir alırdı.,https://eksisozluk.com/leo-fenderin-gitar-calmayi-bilmemesi--5987995,31.03.2019,31.03.2019,1,leo fender'in gitar çalmayı bilmemesi
53,"""şimdi her şeyin böyle ulaşılabilir olması çok güzel. eskiden gitar yoktu, şimdi her bütçeye göre gitar var. ""adam akp sayesinde ülkede bir sürü gitar oldu gibi bi şey dememiş ki gayet doğru bir tespitte bulunmuş. nerenizle okuyosunuz amk. (bkz:gitar tanzim satış) iyice şirazesi kaydı bu memleketin.ayrıca (bkz:ilber ortaylı'nın binali yıldırım'a desteği.)edit: başlık doğru yere taşınınca bir anlam kazandı girdim. (bkz:lassie bize bir şey anlatmaya çalışıyor) suser burada mazhar alanson’un ‘eskiden gitar bulamazdık şimdi her bütçeye uygun gitar var’ şeklinde yapmış olduğu açıklamayla ilgili başlık açma çabasını dile getirmiş benzerlerini eski müzisyenlerden sıklıkla duyabileceğiniz yorum.cem karaca ve barış manço'nun yurt dışına giderken kırık dökük gitarları yanlarında çıkarıp oradan aldıkları yeni gitarları yerine getirdikleri hikayeleri de vardır. evet, eskiden bazı şeyler bulunmuyordu memlekette, şimdi her şey ziyadesiyle mevcut, paran varsa her şeyi alabiliyorsun.mazhar bey'in yorumundaki her bütçeye uygunluk ise tüm dünyada geçerli bir durum, çin malı gitar dolu piyasa. ne kadar eskiden bahsedildiği anlaşılamayan açıklama.zira eskiden mazhar alanson da yoktu. ateş yoktu ateş bulana kadar mağaralar soğuk yemekler çiğ yenildi hep cehape yüzünden. gene kendi kafanıza göre kırpın ve biçin daha sonra burayı ateşe verin. türk halkı okuduğunun ne olduğunu anlamıyordu değil mi? adamın konuşma amacı çeşitlilik yönünden..... önce bir karar ver mazhar,aşkına mı yazdın, kabe'ye mi yazdın o şarkiyi dediğim, son dönem mükemmel bir şekilde hükümete yanlayan dönek adam..",https://eksisozluk.com/eskiden-gitar-yoktu--5982821,26.03.2019,27.03.2019,8,eskiden gitar yoktu
54,"""şimdi her şeyin böyle ulaşılabilir olması çok güzel. eskiden gitar yoktu, şimdi her bütçeye göre gitar var. ""adam akp sayesinde ülkede bir sürü gitar oldu gibi bi şey dememiş ki gayet doğru bir tespitte bulunmuş. nerenizle okuyosunuz amk. (bkz:gitar tanzim satış) iyice şirazesi kaydı bu memleketin.ayrıca (bkz:ilber ortaylı'nın binali yıldırım'a desteği.)edit: başlık doğru yere taşınınca bir anlam kazandı girdim. (bkz:lassie bize bir şey anlatmaya çalışıyor) suser burada mazhar alanson’un ‘eskiden gitar bulamazdık şimdi her bütçeye uygun gitar var’ şeklinde yapmış olduğu açıklamayla ilgili başlık açma çabasını dile getirmiş benzerlerini eski müzisyenlerden sıklıkla duyabileceğiniz yorum.cem karaca ve barış manço'nun yurt dışına giderken kırık dökük gitarları yanlarında çıkarıp oradan aldıkları yeni gitarları yerine getirdikleri hikayeleri de vardır. evet, eskiden bazı şeyler bulunmuyordu memlekette, şimdi her şey ziyadesiyle mevcut, paran varsa her şeyi alabiliyorsun.mazhar bey'in yorumundaki her bütçeye uygunluk ise tüm dünyada geçerli bir durum, çin malı gitar dolu piyasa. ne kadar eskiden bahsedildiği anlaşılamayan açıklama.zira eskiden mazhar alanson da yoktu. ateş yoktu ateş bulana kadar mağaralar soğuk yemekler çiğ yenildi hep cehape yüzünden. gene kendi kafanıza göre kırpın ve biçin daha sonra burayı ateşe verin. türk halkı okuduğunun ne olduğunu anlamıyordu değil mi? adamın konuşma amacı çeşitlilik yönünden..... önce bir karar ver mazhar,aşkına mı yazdın, kabe'ye mi yazdın o şarkiyi dediğim, son dönem mükemmel bir şekilde hükümete yanlayan dönek adam..",https://eksisozluk.com/mazhar-alanson-eskiden-gitar-yoktu--5983084,26.03.2019,27.03.2019,8,mazhar alanson eskiden gitar
